{
  "record_kind": "w14_result",
  "format": "proposed-0.1",
  "record_id": "W14-05/current/2026-10-02",
  "case": "W14-05",
  "phase_reading": "current",
  "run_kind": "rehearsal",
  "evidence_label": "test_double",
  "subject_of_run": {
    "double_identity": "SH-1 + EXEC-v0.6 recorder double",
    "specified_in": "DEL-03-01 C-v0.8 §10.8 (SH-1); DEL-02-03 EXEC-v0.6 §7.4 (recorder and catalog doubles)",
    "files": [
      {
        "path": "PKG-03/DEL-03-01/Design/prototype/simhost.py",
        "sha256": "27693ccf00e0baa9b80475c609342cddb4c026f332d899bfc980e1eb25447434"
      },
      {
        "path": "PKG-03/DEL-03-01/Design/prototype/run_fixture.py",
        "sha256": "88b8a5300320b793ffd403a76b59e2be0b800fa0851486c8f10478906b22c050"
      },
      {
        "path": "PKG-03/DEL-03-03/Design/prototype/observe_map.py",
        "sha256": "df4cf59cbc3d132de93ff7a1fec0607c2c9e0b038f52ae7fb0c949ead85b9f37"
      },
      {
        "path": "PKG-02/DEL-02-03/Design/prototype/checkpoint_recorder.py",
        "sha256": "303ff2de49f2a68504bd2698aced958ca504ca01b35330d4e6511971bf08c9f0"
      },
      {
        "path": "PKG-02/DEL-02-03/Design/prototype/run_all.py",
        "sha256": "5f22b059324ead5cdeace994fd79a256bd88034fdccf2ed2a14d5b1c9f911120"
      }
    ],
    "invented_material": "FX-PIPE-01 (C §10); SH-1 holds a subset (C §10.8)"
  },
  "configuration": {
    "acting_surface_variant": "CA/X",
    "native_path": "both",
    "host_profile": "SH-1 full",
    "model_destination": {
      "not_observed": "the App's Codex is imitated, not run; no App run exists (OBS-1 observed supplier turns at pin 0.158.0 on one local route, not App runs)"
    }
  },
  "date": "2026-10-02",
  "outcome": "inconclusive",
  "parts": [
    {
      "part": "negatives: success, queued, receipt, host check and A14 yield no act",
      "expectation": "T10 queued document carries no decision; T12's receipt, T4a's host check and the declined A14 (XF-34) create no act; no App dispatch record carries a human-act reference",
      "outcome": "passed",
      "built_on": [
        "CH-2",
        "CH-28",
        "CAP-6",
        "ADAPTER XF-31",
        "ADAPTER XF-33"
      ],
      "observations": [
        {
          "what": "T10 queued, no decision",
          "reference": {
            "kind": "host_document",
            "ref": "w14main/T10"
          },
          "linked_not_copied": true
        },
        {
          "what": "T12 RC-1",
          "reference": {
            "kind": "host_receipt",
            "ref": "w14main/T12o"
          },
          "linked_not_copied": true
        },
        {
          "what": "XF-34 declined, no host request",
          "reference": {
            "kind": "dispatch_record",
            "ref": "w14main/XF-34"
          },
          "linked_not_copied": true
        }
      ]
    },
    {
      "part": "positive: the A5 captured by the host facility, actor ≠ recorder, with capture evidence",
      "expectation": "item 1 decision A5 by Engineer A with the facility's capture reference, read over X; the App would record it faithfully citing that reference (RS §6; the RS writer is not exercised here)",
      "outcome": "passed",
      "built_on": [
        "T11",
        "ADAPTER S-9"
      ],
      "observations": [
        {
          "what": "T11 item 1 A5 ACT-2 capture SH1-CAP-2",
          "reference": {
            "kind": "act_record",
            "ref": "w14main/T11o/ACT-2"
          },
          "linked_not_copied": true
        }
      ]
    },
    {
      "part": "earlier act on current content counts (CH-20)",
      "expectation": "T2's A4 counts for S-2, cited with its time; A4 on S-3 completes the answer (JA-1)",
      "outcome": "passed",
      "built_on": [
        "CH-20"
      ],
      "observations": [
        {
          "what": "recorder entries CH-20",
          "reference": {
            "kind": "exec_entries",
            "ref": "run-e1b-1"
          },
          "linked_not_copied": true
        }
      ]
    },
    {
      "part": "earlier act on content no longer current: 'prior act not counted' (CH-31 (i); R11-9)",
      "expectation": "T2's A4 on ⟨S-2@r12⟩ at a run-14 arrival binding ⟨S-2@r15⟩ is recorded 'prior act not counted' (content no longer current); the arrival waits; a new A4 answers",
      "outcome": "passed",
      "built_on": [
        "CH-31"
      ],
      "observations": [
        {
          "what": "recorder entries CH-31 (i)",
          "reference": {
            "kind": "exec_entries",
            "ref": "run-14"
          },
          "linked_not_copied": true
        }
      ]
    },
    {
      "part": "earlier act of another kind: 'prior act not counted' (CH-31 (ii))",
      "expectation": "an earlier A6 counts at CP-approve and is 'prior act not counted' (another act kind) at CP-check",
      "outcome": "passed",
      "built_on": [
        "CH-31"
      ],
      "observations": [
        {
          "what": "recorder entries CH-31 (ii)",
          "reference": {
            "kind": "exec_entries",
            "ref": "run-sign-1"
          },
          "linked_not_copied": true
        }
      ]
    },
    {
      "part": "App-side variant: A4, A6, A7 on AF-1 kept apart (CH-23, CH-32)",
      "expectation": "each arrival answered only by its own kind; A7 actor with its evidence limit",
      "outcome": "not_run",
      "not_run_because": "App act control not built (DEL-01-04, later); CH-32's arrival event is OBS-1 pending",
      "built_on": [
        "CH-23",
        "CH-32"
      ]
    },
    {
      "part": "the person's actual act on invented material",
      "expectation": "a real person performs A5/A4 in the host facility",
      "outcome": "not_run",
      "not_run_because": "no person act is performed in a rehearsal; SWBPIPE offers no capture-evidence reference (SQ-01)"
    }
  ],
  "evidence_limits": [
    "unverified caller identity"
  ],
  "missing_inputs": [
    {
      "input": "capture-evidence reference for host-captured acts",
      "supplier": "SWBPIPE owner",
      "relay_question": "SQ-01"
    },
    {
      "input": "an actual person performing the act on invented material",
      "supplier": "the person (DEP-09-06-024)"
    },
    {
      "input": "App act control for the AF-1 variant and for a joined CH-31 (ii)",
      "supplier": "DEL-01-04 (later undertaking)"
    },
    {
      "input": "an identified SWBPIPE host candidate; host joins deferred",
      "supplier": "SWBPIPE owner (DECISION-3)",
      "relay_question": "SQ-27"
    }
  ],
  "completion": {
    "counts_toward_out003": false,
    "reason": "a rehearsal on a test double never completes a W14 case (CA §8.1, §8.3)"
  },
  "case_state_at_run": "AWAITING INPUT",
  "act_records_cited": [
    {
      "record_id": "ACT-2",
      "act_kind": "A5",
      "actor": "Engineer A (fixture person, SH-1 facility)",
      "recorder": "SH-1 facility (the double's own)",
      "capture_evidence": {
        "reference": "SH1-CAP-2"
      },
      "counted_as": "not evaluated"
    },
    {
      "record_id": "rec:app:run-14:A4-T2",
      "act_kind": "A4",
      "actor": "Engineer A (scripted)",
      "recorder": "EXEC recorder double",
      "capture_evidence": {
        "absent": "scripted observation; no capture facility in the recorder double"
      },
      "counted_as": "prior act not counted",
      "not_counted_reason": "content no longer current"
    }
  ]
}
